店舗名,住所
マックスバリュ永江団地店,熊本県合志市幾久富１８６６-１３９５
マックスバリュみずき台店,熊本県合志市須屋３５４７番
マックスバリュ光の森店,熊本県菊池郡菊陽町光の森５丁目１４-１
マックスバリュ賀来店,大分県大分市賀来南３丁目４-４６
マックスバリュ桜坂店,大分県大分市大字牧１０３０-１
マックスバリュ坂ノ市店,大分県大分市大字久原中央１丁目２-２６
マックスバリュ大在店,大分県大分市角子原１丁目１２-２２
マックスバリュ南下郡店,大分県大分市大字下郡３２６０番地
マックスバリュ猪野店,大分県大分市大字猪野字中原１２４８
マックスバリュくらし館高田店,大分県大分市大字下徳丸４
マックスバリュ南大分店,大分県大分市明磧町１丁目１５番３号
マックスバリュ別府店,大分県別府市新港町４-３９
マックスバリュ別府上原店,大分県別府市上原町９番３号
マックスバリュ佐伯駅前店,大分県佐伯市駅前１丁目６-２７
マックスバリュ市浜店,大分県臼杵市市浜京泊７０８-１
マックスバリュ霧島店,宮崎県宮崎市霧島１丁目６９番地
マックスバリュ島之内店,宮崎県宮崎市大字島之内字境田６３５３
マックスバリュうきのじょう店,宮崎県宮崎市柳丸町１６７
マックスバリュ木花台店,宮崎県宮崎市学園木花台西１-３-１
マックスバリュ宮崎駅東店,宮崎県宮崎市宮崎駅東３丁目１-２
マックスバリュ清武店,宮崎県宮崎市清武町正手２丁目３７-８
マックスバリュ橘通西店,宮崎県宮崎市橘通西４丁目４番８号
マックスバリュくらし館田野店,宮崎県宮崎市田野町甲２９５６-３
マックスバリュ都城店,宮崎県都城市千町４３５１-２
マックスバリュ都北店,宮崎県都城市都北町５９８０番地
マックスバリュ岡富店,宮崎県延岡市中川原町２-４９２０
マックスバリュ南延岡店,宮崎県延岡市構口町２丁目２０４-７
マックスバリュ西都店,宮崎県西都市大字右松２１４０-１
マックスバリュ綾店,宮崎県東諸県郡綾町大字南俣字郷鴫１８０
マックスバリュ高鍋店,宮崎県児湯郡高鍋町大字北高鍋１３６６-６
マックスバリュ武岡店,鹿児島県鹿児島市武岡１丁目１１５-１
マックスバリュオプシアミスミ店,鹿児島県鹿児島市宇宿２丁目３番５号
マックスバリュ東郡元店,鹿児島県鹿児島市東郡元町１９番２６号
マックスバリュ花野団地店,鹿児島県鹿児島市花野光が丘２丁目４９番２号
マックスバリュ上荒田店,鹿児島県鹿児島市上荒田町３９番３０号
マックスバリュ西原店,鹿児島県鹿屋市今坂町１０１１８番２３
マックスバリュ鹿屋寿店,鹿児島県鹿屋市寿３丁目１３番３９号
マックスバリュリナシティかのや店,鹿児島県鹿屋市大手町１番１-１１０１
マックスバリュエクスプレス末吉店,鹿児島県曽於市末吉町二之方６０３２-１
マックスバリュ国分店,鹿児島県霧島市国分中央１丁目２７番５号
マックスバリュエクスプレス松木店,鹿児島県霧島市国分中央５丁目２０番５２号
マックスバリュ笠之原店,鹿児島県肝属郡肝付町富山１０１２-１
マックスバリュ新都心めかる店,沖縄県那覇市銘苅１-１０-１５
マックスバリュ牧志店,沖縄県那覇市牧志２丁目１０番１号
マックスバリュ安謝店,沖縄県那覇市字安謝６６４-３２
マックスバリュ壺川店,沖縄県那覇市壺川２丁目４番２
マックスバリュ若狭店,沖縄県那覇市若狭１丁目１９-１
マックスバリュ松山店,沖縄県那覇市松山２丁目２２番１号
マックスバリュ新川店,沖縄県石垣市字新栄町７５
マックスバリュ石垣店,沖縄県石垣市字登野城１１５７
マックスバリュ平真店,沖縄県石垣市登野城６３２番地
マックスバリュやいま店,沖縄県石垣市字真栄里２９２番地の１
マックスバリュ伊祖店,沖縄県浦添市伊祖２-１９-３
マックスバリュなご店,沖縄県名護市字宮里１５９２
マックスバリュ糸満北店,沖縄県糸満市兼城３７０
マックスバリュ武富店,沖縄県糸満市武富仲間田原１９４番地
マックスバリュ泡瀬店,沖縄県沖縄市泡瀬４-５-７
マックスバリュ知花店,沖縄県沖縄市知花６丁目１０-１
マックスバリュ高原店,沖縄県沖縄市高原１丁目１１-１
マックスバリュ山里店,沖縄県沖縄市山里１丁目１-２
マックスバリュとよみ店,沖縄県豊見城市字根差部７１０
マックスバリュ豊見城店,沖縄県豊見城市字田頭１５５-１
マックスバリュ石川店,沖縄県うるま市石川１-１６-１
マックスバリュ屋慶名店,沖縄県うるま市与那城屋慶名３５１７番地
マックスバリュ宮古南店,沖縄県宮古島市平良字松原６３１番地
マックスバリュ宮古西里店,沖縄県宮古島市平良字西里１２９０
マックスバリュ南城大里店,沖縄県南城市大里字高平高宮城原９７番２
マックスバリュ金武店,沖縄県国頭郡金武町字金武７９０６-２
マックスバリュ読谷店,沖縄県中頭郡読谷村字古堅７４０番地
マックスバリュ座喜味店,沖縄県中頭郡読谷村字上地２０５-１
マックスバリュ坂田店,沖縄県中頭郡西原町西原西地区土地区画整理事業地内２８街区１
マックスバリュ兼久店,沖縄県中頭郡西原町字兼久４４番１
マックスバリュ一日橋店,沖縄県島尻郡南風原町字兼城５３０
マックスバリュ八重瀬店,沖縄県島尻郡八重瀬町伊覇３０７番地
